[
  {
    "lifeEventId": "3456789001",
    "eventType": "Funds release",
    "eventDate": "2017-05-05",
    "withdrawalAmount": 5000.00,
    "supersede": {
      "originalLifeEventId": "3456789000",
      "originalEventDate": "2017-05-10"
    }
  },
  {
    "lifeEventId": "6789000002",
    "eventDate": "2017-05-11",
    "eventType": "Extension one",
    "supersede": {
      "originalEventDate": "2017-05-10",
      "originalLifeEventId": "6789000001"
    }
  },
  {
    "lifeEventId": "6789000004",
    "eventDate": "2017-08-11",
    "eventType": "Extension two",
    "supersede": {
      "originalEventDate": "2017-08-10",
      "originalLifeEventId": "6789000003"
    }
  },
  {
    "lifeEventId": "5678900002",
    "fundReleaseId": "3456789001",
    "eventDate": "2017-06-10",
    "eventType": "Purchase outcome",
    "propertyPurchaseResult": "Purchase completed",
    "propertyPurchaseValue": 250000,
    "supersede": {
      "originalLifeEventId": "5678900001",
      "originalEventDate": "2017-05-05"
    }
  }
]
